"question,option_a,option_b,option_c,option_d,answer,tier,topic"
"What is the slope of a line passing through points (3, -2) and (-1, 4)?,""-3/2"",""3/2"",""-2/3"",""2/3"",a,c1,straight_lines"
"The slope of x-axis is:,""0"",""1"",""undefined"",""not defined"",a,c1,straight_lines"
"The slope of y-axis is:,""0"",""1"",""undefined"",""-1"",c,c1,straight_lines"
"A line makes an angle of 60° with the positive direction of x-axis. Its slope is:,""1/2"",""√3"",""1/√3"",""1"",b,c1,straight_lines"
"Find the slope of the line passing through (0, -4) and (8, 0).,""-1/2"",""1/2"",""-2"",""2"",b,c1,straight_lines"
"If two lines are parallel, their slopes are:,""equal"",""negative reciprocals"",""product is -1"",""unrelated"",a,c1,straight_lines"
"If two lines are perpendicular, the product of their slopes is:,""-1"",""0"",""1"",""undefined"",a,c1,straight_lines"
"The equation of x-axis is:,""x = 0"",""y = 0"",""x = y"",""x + y = 0"",b,c1,straight_lines"
"The equation of y-axis is:,""x = 0"",""y = 0"",""x = y"",""x + y = 0"",a,c1,straight_lines"
"A horizontal line parallel to x-axis at distance 3 units above it has equation:,""x = 3"",""y = 3"",""x = -3"",""y = -3"",b,c1,straight_lines"
"A vertical line parallel to y-axis at distance 2 units to the left of it has equation:,""x = 2"",""y = 2"",""x = -2"",""y = -2"",c,c1,straight_lines"
"The slope of the line 3x - 4y + 10 = 0 is:,""3/4"",""-3/4"",""4/3"",""-4/3"",a,c1,straight_lines"
"The y-intercept of the line y = 2x + 5 is:,""2"",""5"",""-5"",""0"",b,c1,straight_lines"
"The equation of a line with slope 2 and y-intercept -3 is:,""y = 2x - 3"",""y = 2x + 3"",""y = -2x + 3"",""y = -2x - 3"",a,c1,straight_lines"
"Which of the following points lies on the line 2x + 3y = 6?,""(0, 2)"",""(2, 0)"",""(1, 1)"",""(3, 1)"",a,c2,straight_lines"
"The slope of a line making inclination 45° with positive x-axis is:,""0"",""1"",""-1"",""√3"",b,c1,straight_lines"
"Points (4, 4), (3, 5) and (-1, -1) form:,""an equilateral triangle"",""an isosceles triangle"",""a right angled triangle"",""a scalene triangle"",c,c2,straight_lines"
"The distance between points (6, -4) and (3, 0) is:,""5 units"",""4 units"",""3 units"",""6 units"",a,c2,straight_lines"
"The equation of the line through (-2, 3) with slope 1/2 is:,""x - 2y + 8 = 0"",""2x - y + 7 = 0"",""x + 2y - 4 = 0"",""x - 2y + 4 = 0"",a,c2,straight_lines"
"The equation of the line through (1, -1) and (3, 5) is:,""3x - y - 4 = 0"",""x - 3y - 4 = 0"",""3x + y - 2 = 0"",""x + y - 4 = 0"",a,c2,straight_lines"
"A line with x-intercept 4 and y-intercept 3 has equation:,""3x + 4y = 12"",""4x + 3y = 12"",""x/4 + y/3 = 1"",""x/3 + y/4 = 1"",a,c2,straight_lines"
"The line through (2, 3) parallel to x-axis has equation:,""x = 2"",""y = 3"",""x = 3"",""y = 2"",b,c1,straight_lines"
"The line through (2, 3) parallel to y-axis has equation:,""x = 2"",""y = 3"",""x = 3"",""y = 2"",a,c1,straight_lines"
"If slope of one line is 2, what is the slope of a line perpendicular to it?,""-1/2"",""1/2"",""-2"",""2"",a,c2,straight_lines"
"The angle between the lines √3x + y = 1 and x + √3y = 1 is:,""30°"",""45°"",""60°"",""90°"",a,c3,straight_lines"
"The distance of point (3, -5) from line 3x - 4y - 26 = 0 is:,""3 units"",""4 units"",""5 units"",""6 units"",a,c2,straight_lines"
"The distance between parallel lines 3x - 4y + 7 = 0 and 3x - 4y + 5 = 0 is:,""2/5 units"",""3/5 units"",""4/5 units"",""1 unit"",a,c2,straight_lines"
"Points (3, 0), (-2, -2) and (8, 2) are:,""collinear"",""vertices of equilateral triangle"",""vertices of right triangle"",""vertices of isosceles triangle"",a,c2,straight_lines"
"The equation of line with slope -4 passing through (-2, 3) is:,""4x + y + 5 = 0"",""4x - y + 5 = 0"",""4x + y - 5 = 0"",""x + 4y + 5 = 0"",a,c2,straight_lines"
"Find the equation of line parallel to 3x - 4y + 2 = 0 and passing through (-2, 3).,""3x - 4y + 18 = 0"",""3x + 4y - 6 = 0"",""4x - 3y + 17 = 0"",""3x - 4y - 18 = 0"",a,c2,straight_lines"
"The line x - 7y + 5 = 0 is perpendicular to which of the following?,""7x + y + 3 = 0"",""x - 7y + 3 = 0"",""7x - y + 3 = 0"",""x + 7y + 3 = 0"",a,c2,straight_lines"
"The acute angle between lines with slopes m_ = 1/2 and m_ = 3 is:,""45°"",""60°"",""tan__(1/7)"",""tan__(5/7)"",d,c3,straight_lines"
"If angle between two lines is π/4 and slope of one line is 1/2, the slope of other line is:,""3 or -1/3"",""2 or -2"",""3 or 1/3"",""-3 or 1/3"",a,c3,straight_lines"
"The perpendicular from origin to line y = mx + c meets it at (-1, 2). Find m:,""1/2"",""-1/2"",""2"",""-2"",b,c3,straight_lines"
"A line cuts off equal intercepts on coordinate axes and passes through (2, 3). Its equation is:,""x + y = 5"",""x - y = 1"",""2x + 3y = 13"",""x + y = 1"",a,c2,straight_lines"
"The equation of line making intercepts whose sum is 9 and passing through (2, 2) is:,""2x + y - 6 = 0 or x + 2y - 6 = 0"",""x + y - 4 = 0"",""2x + 3y - 10 = 0"",""x + y - 9 = 0"",a,c3,straight_lines"
"The area of triangle with vertices (4, 4), (3, -2) and (-3, 16) is:,""27 sq units"",""54 sq units"",""13.5 sq units"",""36 sq units"",a,c2,straight_lines"
"If area of triangle with vertices (x_, y_), (x_, y_) and (x_, y_) is zero, the points are:,""collinear"",""forming equilateral triangle"",""forming right triangle"",""non-coplanar"",a,c2,straight_lines"
"The base of equilateral triangle with side 2a lies along y-axis with mid-point at origin. The vertices are:,""(±√3a, 0) and (0, a)"",""(0, ±a) and (√3a, 0)"",""(±a, 0) and (0, √3a)"",""(0, ±a) and (±√3a, 0)"",b,c3,straight_lines"
"Line through (-2, 6) and (4, 8) is perpendicular to line through (8, 12) and (x, 24). Find x:,""4"",""8"",""12"",""16"",a,c3,straight_lines"
"The equation of line through origin making angle _ with line y = mx + c is:,""y/x = (m ± tan_)/(1 _ m tan_)"",""y = x tan_"",""y = mx"",""x = y tan_"",a,c4,straight_lines"
"In what ratio does line x + y = 4 divide the line joining (-1, 1) and (5, 7)?,""1:2 internally"",""2:1 internally"",""1:2 externally"",""1:1 internally"",a,c3,straight_lines"
"Distance of line 4x + 7y + 5 = 0 from point (1, 2) along line 2x - y = 0 is:,""√65 units"",""65 units"",""√13 units"",""13 units"",a,c4,straight_lines"
"Image of point (3, 8) with respect to line x + 3y = 7 is:,""(-1, 4)"",""(1, -4)"",""(4, -1)"",""(-4, 1)"",a,c4,straight_lines"
"If lines y = 3x + 1 and 2y = x + 3 are equally inclined to y = mx + 4, find m:,""1/2 or 2"",""1/3 or 3"",""1/5 or 5"",""1/6 or 6"",c,c4,straight_lines"
"The perpendicular distance from origin to line joining (cos_, sin_) and (cos_, sin_) is:,""sin((_-_)/2)"",""cos((_-_)/2)"",""sin((_+_)/2)"",""cos((_+_)/2)"",a,c3,straight_lines"
"A line parallel to y-axis at distance 3 to left of origin has equation:,""x = -3"",""y = -3"",""x = 3"",""y = 3"",a,c1,straight_lines"
"The slope of line making angle 30° with positive y-axis measured anticlockwise is:,""√3"",""1/√3"",""-1/√3"",""-√3"",c,c2,straight_lines"
"Equation of line with tan _ = 1/2, y-intercept -3/2 is:,""x - 2y - 3 = 0"",""2x - y - 3 = 0"",""x + 2y + 3 = 0"",""x - 2y + 3 = 0"",a,c2,straight_lines"
"Equation of line with tan _ = 1/2, x-intercept 4 is:,""x - 2y - 4 = 0"",""2x - y - 4 = 0"",""x + 2y - 4 = 0"",""2x + y - 4 = 0"",a,c2,straight_lines"
"The coordinates of foot of perpendicular from (-1, 3) to line 3x - 4y - 16 = 0 are:,""(4, -1)"",""(-1, 4)"",""(1, -4)"",""(-4, 1)"",a,c3,straight_lines"
"Lines 2x + y - 3 = 0, 5x + ky - 3 = 0 and 3x - y - 2 = 0 are concurrent when k equals:,""-2"",""2"",""-3"",""3"",a,c3,straight_lines"
"If p and q are perpendicular distances from origin to lines xcos_ - ysin_ = kcos2_ and xsec_ + ycosec_ = k, then:,""p_ + 4q_ = k_"",""p_ + 2q_ = k_"",""2p_ + q_ = k_"",""p_ + q_ = k_"",a,c4,straight_lines"
"Equation of altitude from vertex A(2, 3) in triangle ABC with B(4, -1) and C(1, 2) is:,""3x + y = 9"",""x + 3y = 11"",""3x - y = 3"",""x - 3y = -7"",a,c3,straight_lines"
"The line equidistant from parallel lines 9x + 6y - 7 = 0 and 3x + 2y + 6 = 0 is:,""9x + 6y + 11 = 0"",""3x + 2y - 1/2 = 0"",""18x + 12y + 5 = 0"",""9x + 6y - 25 = 0"",c,c3,straight_lines"
"Distance between point (x_, y_) and (x_, y_) when PQ is parallel to y-axis is:,""|x_ - x_|"",""|y_ - y_|"",""0"",""undefined"",b,c1,straight_lines"
"Distance between point (x_, y_) and (x_, y_) when PQ is parallel to x-axis is:,""|x_ - x_|"",""|y_ - y_|"",""0"",""undefined"",a,c1,straight_lines"
"Point on x-axis equidistant from (7, 6) and (3, 4) is:,""(3, 0)"",""(0, 3)"",""(-3, 0)"",""(0, -3)"",a,c2,straight_lines"
"Slope of line through origin and mid-point of segment joining P(0, -4) and B(8, 0) is:,""1/2"",""-1/2"",""2"",""-2"",b,c2,straight_lines"
"Without using distance formula, points (-2, -1), (4, 0), (3, 3) and (-3, 2) form:,""parallelogram"",""rectangle"",""rhombus"",""square"",a,c2,straight_lines"
"Angle between x-axis and line joining (3, -1) and (4, -2) is:,""45°"",""135°"",""60°"",""120°"",b,c2,straight_lines"
"If slope of line is double the slope of another and tan of angle between them is 1/3, the slopes are:,""1 and 2"",""2 and 4"",""1/2 and 1"",""3 and 6"",a,c3,straight_lines"
"Vertices of triangle are A(2, 3), B(4, -1), C(1, 2). Equation of median through R(4, 5) is:,""x - 3y + 11 = 0"",""3x - y - 7 = 0"",""x + 3y - 19 = 0"",""3x + y - 17 = 0"",d,c3,straight_lines"
"Equation of line passing through (-3, 5) perpendicular to line through (2, 5) and (-3, 6) is:,""5x - y + 20 = 0"",""x - 5y + 28 = 0"",""5x + y + 10 = 0"",""x + 5y - 22 = 0"",a,c2,straight_lines"
"A line perpendicular to segment joining (1, 0) and (2, 3) divides it in ratio 1:n. Its equation is:,""3x + y = (3 + 3n)/(1 + n)"",""x - 3y + 3 = 0"",""3x - y = 3"",""x + 3y = 3"",a,c4,straight_lines"
"Equation of line through (0, 2) making angle 2π/3 with positive x-axis is:,""√3x + y - 2 = 0"",""x + √3y - 2√3 = 0"",""√3x + y + 2 = 0"",""y + √3x - 2 = 0"",a,c2,straight_lines"
"Perpendicular from origin to a line meets it at (-2, 9). Equation of line is:,""2x - 9y + 85 = 0"",""9x + 2y + 36 = 0"",""2x + 9y - 85 = 0"",""9x - 2y + 36 = 0"",a,c3,straight_lines"
"Length L (cm) of copper rod is linear function of Celsius temperature C. If L = 124.942 when C = 20 and L = 125.134 when C = 110, express L in terms of C:,""L = 0.00213C + 124.9"",""L = 0.002C + 124.9"",""L = 0.00213C + 125"",""L = 0.002C + 125"",a,c3,straight_lines"
"Milk store sells 980 liters at Rs 14/liter and 1220 liters at Rs 16/liter. Assuming linear relationship, liters sold at Rs 17/liter:,""1340 liters"",""1300 liters"",""1280 liters"",""1360 liters"",a,c3,straight_lines"
"P(a, b) is mid-point of line segment between axes. Equation of line is:,""x/a + y/b = 2"",""x/2a + y/2b = 1"",""2x/a + 2y/b = 1"",""x/a + y/b = 1/2"",a,c3,straight_lines"
"Point R(h, k) divides line segment between axes in ratio 1:2. Equation of line is:,""x/3h + y/3k = 1"",""x/2h + y/k = 1"",""2x/h + y/k = 1"",""x/h + 2y/k = 1"",a,c4,straight_lines"
"The slope-intercept form of x + 7y = 0 is:,""y = -x/7, slope = -1/7"",""y = x/7, slope = 1/7"",""y = -7x, slope = -7"",""y = 7x, slope = 7"",a,c1,straight_lines"
"The slope-intercept form of 6x + 3y - 5 = 0 is:,""y = -2x + 5/3"",""y = 2x - 5/3"",""y = -2x - 5/3"",""y = 2x + 5/3"",a,c2,straight_lines"
"The intercept form of 3x + 2y - 12 = 0 is:,""x/4 + y/6 = 1"",""x/6 + y/4 = 1"",""x/3 + y/2 = 12"",""x/12 + y/12 = 1"",a,c2,straight_lines"
"The intercept form of 4x - 3y = 6 is:,""x/(3/2) + y/(-2) = 1"",""x/6 + y/(-2) = 1"",""x/(3/2) + y/2 = 1"",""x/4 + y/(-3) = 1"",a,c2,straight_lines"
"Distance of point (-1, 1) from line 12(x + 6) = 5(y - 2) is:,""13/5 units"",""5/13 units"",""12/5 units"",""5/12 units"",a,c2,straight_lines"
"Points on x-axis whose distance from line x/3 + y/4 = 1 is 4 units are:,""(7, 0) and (-7, 0)"",""(3, 0) and (-3, 0)"",""(4, 0) and (-4, 0)"",""(8, 0) and (-1, 0)"",d,c3,straight_lines"
"Distance between parallel lines 15x + 8y - 34 = 0 and 15x + 8y + 31 = 0 is:,""65/17 units"",""31/17 units"",""34/17 units"",""17/15 units"",a,c2,straight_lines"
"Distance between parallel lines l(x + y) + p = 0 and l(x + y) - r = 0 is:,""|p + r|/(l√2)"",""|p - r|/(l√2)"",""|p + r|/l"",""|p - r|/l"",a,c2,straight_lines"
"Line through (h, 3) and (4, 1) intersects 7x - 9y - 19 = 0 at right angle. Value of h is:,""18/7"",""7/18"",""-18/7"",""-7/18"",a,c3,straight_lines"
"If lines 2x + y - 3 = 0, 5x + ky - 3 = 0 and 3x - y - 2 = 0 are concurrent, then k equals:,""-2"",""2"",""5"",""3"",a,c3,straight_lines"